[
  {
    "id": "SYN_001_CLEAN_ENGLISH",
    "name": "Synthetic Clean Standard FMCG Label",
    "category": "synthetic_standard",
    "language": "eng",
    "level": "level_1_synthetic",
    "split": "benchmark",
    "expectedFields": {
      "mrp": "₹120.00",
      "netQuantity": "500 g",
      "manufacturer": "ABC FOODS PVT LTD",
      "address": "PLOT 42, PHASE 1, ELECTRONIC CITY, BANGALORE 560100",
      "packingDate": "06/2024",
      "consumerCare": "1800-425-0000"
    },
    "expectedCompliance": {
      "status": "PASS",
      "flaggedCount": 0,
      "violations": []
    },
    "ocrText": "ABC FOODS PVT LTD\nPLOT 42, PHASE 1, ELECTRONIC CITY, BANGALORE 560100\nNET WEIGHT: 500 g\nPKD: 06/2024\nMRP: ₹ 120.00 (INCL. OF ALL TAXES)\nCONSUMER CARE HELPLINE: 1800-425-0000, care@abcfoods.com",
    "notes": "Standard clean synthetic baseline"
  },
  {
    "id": "SYN_002_DOT_MATRIX_FOIL",
    "name": "Synthetic Dot-Matrix Stamped Packaging",
    "category": "synthetic_degraded",
    "language": "eng",
    "level": "level_1_synthetic",
    "split": "benchmark",
    "expectedFields": {
      "mrp": "₹45.00",
      "netQuantity": "100 g",
      "manufacturer": "ZENITH BAKERS LTD",
      "address": "INDUSTRIAL ESTATE, CHENNAI 600032",
      "packingDate": "04/2024",
      "consumerCare": "feedback@zenith.in"
    },
    "expectedCompliance": {
      "status": "PASS",
      "flaggedCount": 0,
      "violations": []
    },
    "ocrText": "ZENITH BAKERS LTD\nINDUSTRIAL ESTATE, CHENNAI 600032\nNET QTY : 100 g\nMFD . 04/2024\nMRP Rs. 45.00 INCL ALL TAXES\nCONSUMER CELL: feedback@zenith.in",
    "notes": "Dot-matrix style spacing and Rs. notation"
  },
  {
    "id": "SYN_003_LOW_CONTRAST_GRAY",
    "name": "Synthetic Low Contrast Faint Print",
    "category": "synthetic_degraded",
    "language": "eng",
    "level": "level_1_synthetic",
    "split": "benchmark",
    "expectedFields": {
      "mrp": "₹299.00",
      "netQuantity": "200 ml",
      "manufacturer": "ORGANIC VIBES LLP",
      "address": "SECTOR 18, GURGAON 122001",
      "packingDate": "05/2024",
      "consumerCare": "0124-4998800"
    },
    "expectedCompliance": {
      "status": "PASS",
      "flaggedCount": 0,
      "violations": []
    },
    "ocrText": "ORGANIC VIBES LLP\nSECTOR 18, GURGAON 122001\nNET CONTENT : 200 ml\nBATCH NO : B-402\nMFG DATE : 05/2024\nMAX RETAIL PRICE ₹ 299.00 INCLUSIVE OF ALL TAXES\nCUSTOMER CARE : 0124-4998800",
    "notes": "Low contrast beverage bottle label"
  },
  {
    "id": "SYN_004_MISSING_MRP_NONCOMPLIANT",
    "name": "Synthetic Label Missing Mandatory MRP",
    "category": "synthetic_violation",
    "language": "eng",
    "level": "level_1_synthetic",
    "split": "benchmark",
    "expectedFields": {
      "mrp": null,
      "netQuantity": "1 kg",
      "manufacturer": "GRAIN KING ENTERPRISES",
      "address": "GRAIN MARKET, KARNAL, HARYANA 132001",
      "packingDate": "02/2024",
      "consumerCare": "1800112233"
    },
    "expectedCompliance": {
      "status": "REVIEW",
      "flaggedCount": 1,
      "violations": ["Rule 6(1)(da)"]
    },
    "ocrText": "GRAIN KING ENTERPRISES\nGRAIN MARKET, KARNAL, HARYANA 132001\nPREMIUM BASMATI RICE\nNET QUANTITY: 1 kg\nPKD: 02/2024\nFOR FEEDBACK CALL 1800112233",
    "notes": "Deliberately omitted MRP declaration"
  },
  {
    "id": "SYN_005_MISSING_NET_QTY_NONCOMPLIANT",
    "name": "Synthetic Label Missing Net Quantity",
    "category": "synthetic_violation",
    "language": "eng",
    "level": "level_1_synthetic",
    "split": "benchmark",
    "expectedFields": {
      "mrp": "₹80.00",
      "netQuantity": null,
      "manufacturer": "CRUNCHY BITES CO",
      "address": "MIDC AREA, PUNE 411018",
      "packingDate": "03/2024",
      "consumerCare": "care@crunchy.com"
    },
    "expectedCompliance": {
      "status": "REVIEW",
      "flaggedCount": 1,
      "violations": ["Rule 6(1)(c)"]
    },
    "ocrText": "CRUNCHY BITES CO\nMIDC AREA, PUNE 411018\nROASTED ALMONDS\nMFD DATE: 03/2024\nMRP: ₹ 80.00 INCL TAXES\nCONTACT: care@crunchy.com",
    "notes": "Missing weight/volume declaration"
  },
  {
    "id": "SYN_006_HELD_OUT_SYNTHETIC_CLEAN",
    "name": "Synthetic Held-Out Biscuit Package",
    "category": "synthetic_standard",
    "language": "eng",
    "level": "level_1_synthetic",
    "split": "held_out_test",
    "expectedFields": {
      "mrp": "₹25.00",
      "netQuantity": "150 g",
      "manufacturer": "SUNSHINE BISCUITS PVT LTD",
      "address": "KOLKATA INDUSTRIAL ZONE 700088",
      "packingDate": "07/2024",
      "consumerCare": "1800345678"
    },
    "expectedCompliance": {
      "status": "PASS",
      "flaggedCount": 0,
      "violations": []
    },
    "ocrText": "SUNSHINE BISCUITS PVT LTD\nKOLKATA INDUSTRIAL ZONE 700088\nGLUCOSE TREAT\nNET WT 150 g\nPKD 07/2024\nMRP RS 25.00 INCL ALL TAXES\nHELPLINE NO: 1800345678",
    "notes": "Held-out test verification item"
  },
  {
    "id": "REAL_001_PARLE_G_BISCUITS",
    "name": "Parle-G Glucose Biscuits 250g",
    "category": "food_biscuits",
    "language": "eng",
    "level": "level_2_real",
    "split": "benchmark",
    "expectedFields": {
      "mrp": "₹35.00",
      "netQuantity": "250 g",
      "manufacturer": "PARLE PRODUCTS PVT LTD",
      "address": "PLOT NO 14, INDUSTRIAL AREA, MUMBAI, MAHARASHTRA 400057",
      "packingDate": "08/2024",
      "consumerCare": "1800222211"
    },
    "expectedCompliance": {
      "status": "PASS",
      "flaggedCount": 0,
      "violations": []
    },
    "ocrText": "PARLE-G ORIGINAL GLUCOSE BISCUITS\nMFD BY: PARLE PRODUCTS PVT LTD\nPLOT NO 14, INDUSTRIAL AREA, MUMBAI, MAHARASHTRA 400057\nNET WEIGHT: 250 g\nMFD: 08/2024\nMRP: ₹ 35.00 (INCL. OF ALL TAXES)\nCONSUMER CARE: 1800222211, care@parle.biz",
    "notes": "Real biscuit packaging standard layout"
  },
  {
    "id": "REAL_002_COSMO_SHAMPOO",
    "name": "Silk Shine Nourishing Shampoo 650ml",
    "category": "personal_care",
    "language": "eng",
    "level": "level_2_real",
    "split": "benchmark",
    "expectedFields": {
      "mrp": "₹420.00",
      "netQuantity": "650 ml",
      "manufacturer": "COSMO CARE LABS LTD",
      "address": "SECTOR 62, NOIDA, UP 201301",
      "packingDate": "10/2024",
      "consumerCare": "1800108108"
    },
    "expectedCompliance": {
      "status": "PASS",
      "flaggedCount": 0,
      "violations": []
    },
    "ocrText": "SILK SHINE NOURISHING SHAMPOO\nMANUFACTURED BY: COSMO CARE LABS LTD\nREGD OFFICE: SECTOR 62, NOIDA, UP 201301\nNET VOL: 650 ml\nPKD: 10/2024\nM.R.P. ₹ 420.00 INCL OF ALL TAXES\nFOR CONSUMER COMPLAINTS WRITE TO CARE CELL AT: 1800108108, support@cosmocare.in",
    "notes": "Personal care cosmetic volume declaration"
  },
  {
    "id": "REAL_003_HIMALAYAN_MINERAL_WATER",
    "name": "Natural Mineral Water 1 Litre",
    "category": "beverages",
    "language": "eng",
    "level": "level_2_real",
    "split": "benchmark",
    "expectedFields": {
      "mrp": "₹60.00",
      "netQuantity": "1 l",
      "manufacturer": "HIMALAYAN SPRINGS BEVERAGES PVT LTD",
      "address": "VILLAGE DHARAMPUR, SOLAN, HIMACHAL PRADESH 173209",
      "packingDate": "09/2024",
      "consumerCare": "customercare@himalayansprings.co.in"
    },
    "expectedCompliance": {
      "status": "PASS",
      "flaggedCount": 0,
      "violations": []
    },
    "ocrText": "HIMALAYAN SPRINGS NATURAL MINERAL WATER\nPACKED BY: HIMALAYAN SPRINGS BEVERAGES PVT LTD\nVILLAGE DHARAMPUR, SOLAN, HIMACHAL PRADESH 173209\nNET QUANTITY: 1 L\nMFD: 09/2024\nMRP Rs. 60.00 (INCLUSIVE OF ALL TAXES)\nCONSUMER QUERIES: customercare@himalayansprings.co.in, 01792-234567",
    "notes": "Beverage bottle with Litre unit"
  },
  {
    "id": "REAL_004_SURF_EXCEL_DETERGENT",
    "name": "Stain Remover Laundry Detergent 1kg",
    "category": "household_care",
    "language": "eng",
    "level": "level_2_real",
    "split": "benchmark",
    "expectedFields": {
      "mrp": "₹140.00",
      "netQuantity": "1 kg",
      "manufacturer": "CLEANTECH CONSUMER PRODUCTS LTD",
      "address": "B-12 GIDC ESTATE, ANKLESHWAR, GUJARAT 393002",
      "packingDate": "05/2024",
      "consumerCare": "1800-102-2224"
    },
    "expectedCompliance": {
      "status": "PASS",
      "flaggedCount": 0,
      "violations": []
    },
    "ocrText": "CLEANTECH ACTIVE WASH DETERGENT\nMFD & PKG BY: CLEANTECH CONSUMER PRODUCTS LTD\nB-12 GIDC ESTATE, ANKLESHWAR, GUJARAT 393002\nNET MASS: 1 kg\nDATE OF PACKING: 05/2024\nMRP ₹ 140.00 (INCL OF ALL TAXES)\nCONSUMER HELPLINE: 1800-102-2224",
    "notes": "Detergent carton with NET MASS phrasing"
  },
  {
    "id": "REAL_005_IMPORTED_OLIVE_OIL",
    "name": "Extra Virgin Olive Oil 500ml (Imported)",
    "category": "imported_goods",
    "language": "eng",
    "level": "level_2_real",
    "split": "benchmark",
    "expectedFields": {
      "mrp": "₹750.00",
      "netQuantity": "500 ml",
      "manufacturer": "MEDITERRANEAN OILS S.A., SEVILLE, SPAIN",
      "address": "ANDHERI EAST, MUMBAI 400069",
      "packingDate": "04/2024",
      "consumerCare": "customercare@indoglobalimports.com"
    },
    "expectedCompliance": {
      "status": "PASS",
      "flaggedCount": 0,
      "violations": []
    },
    "ocrText": "MEDITERRANEAN GOLD EXTRA VIRGIN OLIVE OIL\nPRODUCED BY: MEDITERRANEAN OILS S.A., SEVILLE, SPAIN\nIMPORTED & MARKETED IN INDIA BY: INDO GLOBAL IMPORTS PVT LTD\nSUITE 501, COMMERCIAL TOWERS, ANDHERI EAST, MUMBAI 400069\nNET CONTENT: 500 ml\nMONTH & YEAR OF IMPORT: 04/2024\nMAX. RETAIL PRICE: ₹ 750.00 (INCL. OF ALL TAXES)\nFEEDBACK / COMPLAINTS: customercare@indoglobalimports.com, TEL: 022-66778899",
    "notes": "Imported goods with overseas producer and domestic importer"
  },
  {
    "id": "REAL_006_HELD_OUT_REAL_SNACKS",
    "name": "Namkeen Spiced Peanuts 200g",
    "category": "food_snacks",
    "language": "eng",
    "level": "level_2_real",
    "split": "held_out_test",
    "expectedFields": {
      "mrp": "₹50.00",
      "netQuantity": "200 g",
      "manufacturer": "RAJASTHAN SNACKS CO",